<?xml version="1.0" encoding="UTF-8"?>
<dataroot xmlns:od="urn:schemas-microsoft-com:officedata" xmlns:xsi="http://www.w3.org/2001/XMLSchema-instance"  xsi:noNamespaceSchemaLocation="Taminoaciddata.xsd" generated="2020-01-12T15:39:32">
<Taminoaciddata>
<ID>1</ID>
<AA>A</AA>
<MW>213</MW>
<EXT>213</EXT>
</Taminoaciddata>
<Taminoaciddata>
<ID>2</ID>
<AA>B</AA>
<MW>310</MW>
<EXT>310</EXT>
</Taminoaciddata>
<Taminoaciddata>
<ID>3</ID>
<AA>C</AA>
<MW>156</MW>
<EXT>156</EXT>
</Taminoaciddata>
<Taminoaciddata>
<ID>4</ID>
<AA>D</AA>
<MW>243</MW>
<EXT>243</EXT>
</Taminoaciddata>
<Taminoaciddata>
<ID>5</ID>
<AA>E</AA>
<MW>21</MW>
<EXT>21</EXT>
</Taminoaciddata>
<Taminoaciddata>
<ID>6</ID>
<AA>F</AA>
<MW>654</MW>
<EXT>654</EXT>
</Taminoaciddata>
<Taminoaciddata>
<ID>7</ID>
<AA>G</AA>
<MW>213</MW>
<EXT>213</EXT>
</Taminoaciddata>
<Taminoaciddata>
<ID>8</ID>
<AA>H</AA>
<MW>168</MW>
<EXT>168</EXT>
</Taminoaciddata>
<Taminoaciddata>
<ID>9</ID>
<AA>I</AA>
<MW>432</MW>
<EXT>432</EXT>
</Taminoaciddata>
<Taminoaciddata>
<ID>10</ID>
<AA>J</AA>
<MW>879</MW>
<EXT>879</EXT>
</Taminoaciddata>
<Taminoaciddata>
<ID>11</ID>
<AA>K</AA>
<MW>549</MW>
<EXT>549</EXT>
</Taminoaciddata>
<Taminoaciddata>
<ID>12</ID>
<AA>L</AA>
<MW>679</MW>
<EXT>679</EXT>
</Taminoaciddata>
<Taminoaciddata>
<ID>13</ID>
<AA>M</AA>
<MW>126</MW>
<EXT>126</EXT>
</Taminoaciddata>
<Taminoaciddata>
<ID>14</ID>
<AA>N</AA>
<MW>121</MW>
<EXT>121</EXT>
</Taminoaciddata>
<Taminoaciddata>
<ID>15</ID>
<AA>O</AA>
<MW>333</MW>
<EXT>333</EXT>
</Taminoaciddata>
<Taminoaciddata>
<ID>16</ID>
<AA>P</AA>
<MW>515</MW>
<EXT>515</EXT>
</Taminoaciddata>
<Taminoaciddata>
<ID>17</ID>
<AA>Q</AA>
<MW>132</MW>
<EXT>132</EXT>
</Taminoaciddata>
<Taminoaciddata>
<ID>18</ID>
<AA>R</AA>
<MW>134</MW>
<EXT>134</EXT>
</Taminoaciddata>
<Taminoaciddata>
<ID>19</ID>
<AA>S</AA>
<MW>564</MW>
<EXT>564</EXT>
</Taminoaciddata>
<Taminoaciddata>
<ID>20</ID>
<AA>T</AA>
<MW>556</MW>
<EXT>556</EXT>
</Taminoaciddata>
<Taminoaciddata>
<ID>21</ID>
<AA>U</AA>
<MW>489</MW>
<EXT>489</EXT>
</Taminoaciddata>
<Taminoaciddata>
<ID>22</ID>
<AA>V</AA>
<MW>797</MW>
<EXT>797</EXT>
</Taminoaciddata>
<Taminoaciddata>
<ID>23</ID>
<AA>W</AA>
<MW>654</MW>
<EXT>654</EXT>
</Taminoaciddata>
<Taminoaciddata>
<ID>24</ID>
<AA>X</AA>
<MW>437</MW>
<EXT>437</EXT>
</Taminoaciddata>
<Taminoaciddata>
<ID>25</ID>
<AA>Y</AA>
<MW>767</MW>
<EXT>767</EXT>
</Taminoaciddata>
<Taminoaciddata>
<ID>26</ID>
<AA>Z</AA>
<MW>0</MW>
<EXT>0</EXT>
</Taminoaciddata>
</dataroot>
